Game,Score,Reason
The Lord of the Rings: Duel for Middle-earth,120.0,"Area Majority / Influence, Hand Management, Income, Layering, Market, Modular Board, Multi-Use Cards, Once-Per-Game Abilities, Open Drafting, Point to Point Movement, Race, Relative Movement, Set Collection, Sudden Death Ending, Tags, Take That, Tech Trees / Tech Tracks, Variable Player Powers, Variable Set-up, Card Game, Fantasy, Novel-based"
Terraforming Mars,117.25,"Closed Drafting, Contracts, End Game Bonuses, Hand Management, Hexagon Grid, Income, Set Collection, Solo / Solitaire Game, Tags, Take That, Tech Trees / Tech Tracks, Tile Placement, Turn Order: Progressive, Variable Player Powers, Variable Set-up, Victory Points as a Resource, Economic, Environmental, Industry / Manufacturing, Science Fiction, Space Exploration, Territory Building"
Everdell,107.75,"Contracts, End Game Bonuses, Hand Management, Income, Open Drafting, Set Collection, Solo / Solitaire Game, Tags, Variable Set-up, Worker Placement, Animals, Card Game, City Building, Fantasy"
The Castles of Burgundy,83.5,"Dice Rolling, End Game Bonuses, Grid Coverage, Hexagon Grid, Pattern Building, Set Collection, Solo / Solitaire Game, Team-Based Game, Tile Placement, Turn Order: Stat-Based, Variable Set-up, Dice, Medieval, Territory Building"
Mansions of Madness: Second Edition,80.5,"Area Movement, Cooperative Game, Dice Rolling, Hand Management, Map Addition, Modular Board, Role Playing, Scenario / Mission / Campaign Game, Solo / Solitaire Game, Stat Check Resolution, Traitor Game, Variable Player Powers, Adventure, Exploration, Fantasy, Fighting, Horror, Miniatures, Murder / Mystery, Mythology, Puzzle"
